grupo estudio,year,universidad,titulo
Sociología,2014,UNIV.DE SANTIAGO DE CHILE,"Aportes de los estudios de ciencia y tecnología a la comprensión de enfermedades abordadas por la medicina basada en la evidencia: regímenes de subjetivación, corporización y biosocialidad en el GES"
Sociología,2014,PONT. UNIV. CATOLICA DE CHILE,Cyberbullying en Chile: cómo los escolares utilizan las tecnologías de comunicación para relacionarse y sociabilizar con sus pares
Sociología,2014,UNIV.ACADEMIA DE HUMANISMO CRISTIANO,"Usos de medios de comunicación masiva y tics por parte de jóvenes que participan en organizaciones sociales comunitarias en las regiones V, X y metropolitana"
Sociología,2014,UNIV.ANDRES BELLO,"Trayectorias socio-laborales y ciudadanía de mujeres trabajadoras asistidas, en la conurbación provincial de Valparaíso y Marga Marga"
Sociología,2014,UNIV.DE CONCEPCION,En carne propia: relatos y prácticas de lo corporal en jóvenes urbanos de Concepción y Santiago
Sociología,2014,PONT. UNIV. CATOLICA DE CHILE,Flujos informativos y pluralismo en las redes sociales online en Chile: descripción y análisis de las noticias viralizadas por el público
Sociología,2015,UNIV.DE LOS ANDES,Estudio comparativo de las características de los directores de medios de comunicación en Chile y su efecto en la calidad e innovación. Una aproximación desde el liderazgo transformacional
Sociología,2015,UNIV.ADOLFO IBANEZ,Los intermediadores culturales en la era digital: un análisis de las prácticas y tecnologías digitales en la producción de mercados en la industria cultural chilena
Sociología,2015,UNIV.DE VALPARAISO,Articulaciones entre género y memoria social sobre la dictadura cívico-militar chilena desde las prácticas políticas del presente
Sociología,2015,UNIV.ALBERTO HURTADO,La odisea de llegar a fin de mes:  estrategias de pago de deudas en familias jóvenes de clase media en Santiago y Concepción
Sociología,2015,UNIV.DE VALPARAISO,¿Emergencia de un nuevo patrón de nupcialidad? El aumento de la convivencia en grupos medio-altos en Chile
Sociología,2015,UNIV.ALBERTO HURTADO,"Gestionando ""rabanitos"". La disposición empresarial hacia los sindicatos en Chile"
Sociología,2015,PONT. UNIV. CATOLICA DE CHILE,"Developing a comprehensive model of the relationships among expected patient participation in medical decision making, experienced participation and satisfaction with healthcare for the chilean population"
Sociología,2015,UNIV.DE LA FRONTERA,Percepción pública e implicación ciudadana en el control de la contaminación atmosférica urbana del sur de Chile
Sociología,2015,PONT. UNIV. CATOLICA DE CHILE,"A new approach to digital inclusion: understanding the association between digital skills, use of digital resources and tangible outcomes in the population of the metropolitan region of Chile"
Sociología,2015,UNIV.DIEGO PORTALES,"Institucionalización de los ""saberes psi"" y las representaciones del yo (self) a comienzos del siglo XX en Chile (1900-1950): un estudio sociocultural."
Sociología,2015,UNIV.ALBERTO HURTADO,Medios y migración infantil: descripción analítica y comparativa de las prácticas con medios de comunicación de niños y niñas migrantes latinoamericanos en Chile
Sociología,2015,UNIV.CATOLICA DEL NORTE,Reproducción social y posición socio-laboral en Chile
Sociología,2015,PONT. UNIV. CATOLICA DE VALPARAISO,Repertorios de acción política ciudadana  en el Chile post-transición: un estudio narrativo con ex-militantes de izquierda que hoy participan en movimientos socio-ambientales
Sociología,2015,UNIV.SAN SEBASTIAN,El desempeño moral de las cárceles chilenas como pre-requisito para la reinserción social
Sociología,2015,UNIV.FINIS TERRAE,Trayectorias laborales de mujeres y vejez en Chile
Sociología,2015,UNIV.ANDRES BELLO,"Telemedicina, controversia y cambio social en Chile. Cómo la telemedicina se construye socialmente y configura la sociedad"
Sociología,2016,UNIV.DE TALCA,"'Rutinización' de las ti, efectos de la interacción de los usuarios con la tecnología y el grupo social"
Sociología,2016,UNIV.AUSTRAL DE CHILE,Tecnologías de intervención y procesos de subjetivación en los programas de tratamiento y rehabilitación por consumo problemático de sustancias dirigidos a jóvenes con infracción de ley en la región de Los Ríos
Sociología,2016,UNIV.DE CHILE,Cambio en las políticas hacia la infancia y adolescencia en Chile. Análisis de los marcos interpretativos de instituciones y actores relacionados
Sociología,2016,UNIV.ALBERTO HURTADO,Hacer hogar en Santiago. Procesos de subjetivación en el espacio doméstico
Sociología,2016,UNIV.CENTRAL DE CHILE,"Tecnologías de gobierno de la primera infancia, un análisis discursivo del programa Chile crece contigo"
Sociología,2016,UNIV.AUSTRAL DE CHILE,"Radios comunitarias en Chile: descripción y análisis de las variables de asociatividad, comunidad y afectividad en los procesos radialistas en las voces de sus actores"
Sociología,2016,UNIV.CENTRAL DE CHILE,Prácticas sociales y mecanismos de legitimación de la desigualdad en Chile
Sociología,2016,UNIV.DE LA FRONTERA,Acción colectiva y gobernanza comunitaria: en la búsqueda de sustentabilidad de recursos de uso común en el sur de Chile
Sociología,2016,UNIV.DE SANTIAGO DE CHILE,Neurociencias y auto-secularización del cristianismo: ¿un fundamento científico para la religiosidad?
Sociología,2016,UNIV.CATOLICA DE TEMUCO,"Reclutamiento, selección de personal y estructura social: análisis sociológico de los procedimientos seguidos por grandes empresas en Chile"
Sociología,2016,UNIV.ALBERTO HURTADO,Intervención inter-profesional en programas sociales pro-integralidad en Chile: una contribución al public engagement
Sociología,2016,UNIV.ACADEMIA DE HUMANISMO CRISTIANO,"""Mapuche eco-espiritual"": políticas de la diferencia género-racializada en el multiculturalismo neoliberal"
Sociología,2016,UNIV.DE CHILE,Modernización ecológica en Chile. La ruta modernizadora chilena en el contexto de las economías basadas en las industrias extractivas y la construcción de un modelo para el análisis comparativo
Sociología,2016,UNIV.DE SANTIAGO DE CHILE,Human well-being and sustainable management of native forest in rural Chile: are they related?
Sociología,2016,PONT. UNIV. CATOLICA DE VALPARAISO,Investigación en comunicación en Chile: estado del arte y análisis de las características y proyecciones de la comunidad científica nacional
Sociología,2016,UNIV.ANDRES BELLO,Formas de exclusión de los programas de transferencias condicionadas: condiciones (in)cumplidas
Sociología,2016,UNIV.TECNICA FEDERICO SANTA MARIA,Does social media attention matter? A longitudinal assessment of the impact of nonprofits' social media strategies on citizen participation in urban areas
Sociología,2017,UNIV.DE CHILE,El discurso social sobre los profesores en Chile: medios de comunicación e identidad docente en un contexto mediatizado
Sociología,2017,UNIV.AUTONOMA DE CHILE,Normatividades emergentes: la institucionalidad ética en organizaciones sociales chilenas
Sociología,2017,PONT. UNIV. CATOLICA DE VALPARAISO,Subjetividades con las que los y las profesionales de la intervención social directa experiencian su ejercicio laboral: aportes a la formación profesional de pregrado
Sociología,2017,UNIV.DE PLAYA ANCHA CS. EDUCACION,Miradas y proyecciones sobre los canales cortos de comercialización que utilizan las experiencias agroecológicas. Una construcción desde los productores y consumidores de la V región
Sociología,2017,UNIV.ALBERTO HURTADO,El cuerpo en lo social: experiencias corporales reflexivas en torno a la gestión cotidiana del peso corporal en adultos de la ciudad de Santiago de Chile
Sociología,2017,UNIV.ALBERTO HURTADO,"Prácticas de ocio y trabajo cognitivo. Un estudio de los sectores creativos, artísticos e intelectuales"
Sociología,2017,UNIV.SANTO TOMAS,Transformaciones institucionales para el manejo sustentable de sistemas socio-ecológicos costeros: toma de decisiones deliberativas en espacios de acción colectiva
Sociología,2017,UNIV.DE LOS ANDES,El menor de edad como consumidor. Análisis de la publicidad que recibe el usuario de 10 a 14 años a través de los dispositivos móviles
Sociología,2017,UNIV.ACADEMIA DE HUMANISMO CRISTIANO,"Delincuencia, terrorismo y desastres naturales: un estudio sobre la gestión gubernamental del miedo en el Chile de la postdictadura (1990-2020)"
Sociología,2017,UNIV.AUSTRAL DE CHILE,Prácticas 'psi' en la escuela: efectos de la intervención psicosocial en el marco de políticas educativas inclusivas
Sociología,2017,UNIV.DE PLAYA ANCHA CS. EDUCACION,Violencia de género en jóvenes de educación superior: análisis de dos instituciones universitarias en Chile
Sociología,2017,UNIV.CATOLICA DE TEMUCO,Vínculos sociales y corrupción en el contexto público local: la coexistencia de lo formal e informal
Sociología,2017,UNIV.CATOLICA CARDENAL SILVA HENRIQUEZ,Jóvenes en un mundo globalizado: subjetividades y construcción de sí mismos de los jóvenes líderes chilenos alter-activistas en las movilizaciones post 2011
Sociología,2017,UNIV.DE VALPARAISO,El problema de la hiperfrecuentación en la atención primaria de salud en Chile. Hacia una comprensión del malestar inexplicable.
Sociología,2017,UNIV.DEL BIO-BIO,Normalización biopolítica de la ciudad post-catástrofe: tres décadas de grandes terremotos durante el régimen neoliberal en Chile (1985- 2010-2015)
Sociología,2017,UNIV.DE LOS LAGOS,Post-disaster livelihood recovery and adaptations in natural resource-dependent communities in Chile
Sociología,2017,UNIV.ALBERTO HURTADO,Gobierno y autogobierno en la producción de nuevos traders. Una investigación sobre los procesos de incorporación al trabajo en el sector bancario
Sociología,2018,PONT. UNIV. CATOLICA DE CHILE,Emotional and literary repertoires for childhood
Sociología,2018,UNIV.DIEGO PORTALES,Agriculturas campesinas e indígenas en movimiento: sistemas alimentarios alternativos y el giro logístico en el gran Santiago
Sociología,2018,UNIVERSIDAD DE O'HIGGINS,El tratamiento informativo de los inmigrantes en la prensa nacional escrita actual (2015-2019) y su impacto en la opinión pública
Sociología,2018,PONT. UNIV. CATOLICA DE CHILE,Cuidado y crianza entre culturas: saberes y pareceres en las relaciones de cuidado durante la gestación y primera infancia en familias migrantes latinoamericanas en Chile
Sociología,2018,UNIV.CATOLICA DEL MAULE,¿sostener lo insustentable o habilitar sociedades sustentables?: los escenarios de transición hacia la sustentabilidad socio-ecológica en Chile
Sociología,2018,UNIV.CENTRAL DE CHILE,The politics of fictional expectations. Towards an economic sociology of the public sphere in Chile
Sociología,2018,PONT. UNIV. CATOLICA DE CHILE,Religiosidad y bienestar subjetivo de las personas mayores en Chile
Sociología,2018,PONT. UNIV. CATOLICA DE CHILE,Vulnerability among older people in Chile: a life course study of cumulative advantages and disadvantages
Sociología,2018,UNIV.ALBERTO HURTADO,Incendios forestales y nuevo régimen climático: interrogando la producción de conocimiento y valorización del medio ambiente en expertos en bosques en el sur de Chile
Sociología,2018,UNIV.CATOLICA DE LA STMA. CONCEPCION,Convergencias y divergencias entre las trayectorias de vida y las trayectorias de intervención en las programas especializados en explotación sexual comercial de niñas niños y adolescentes
Sociología,2018,UNIV.AUTONOMA DE CHILE,Violencia en las relaciones de pareja joven: nuevas tecnologías de la comunicación y creencias distorsionadas sobre el amor y la violencia
Sociología,2018,UNIV.CATOLICA DE TEMUCO,"""Las que tienen hijos chicos no pueden ir a trabajar"": la organización social del cuidado como condición de la participación de mujeres en asociaciones productivas rurales de la Araucanía"
Sociología,2018,UNIV.DE CHILE,Partidos-movimiento en acción: el caso del frente amplio en Chile
Sociología,2018,UNIV.DIEGO PORTALES,Entornos de información de salud y su impacto en la adopción y mantención de comportamientos saludables
Sociología,2018,UNIV.DIEGO PORTALES,Cultura tributaria: conocimiento y moral en el pago de impuestos en la sociedad chilena
Sociología,2018,PONT. UNIV. CATOLICA DE CHILE,Descripción y análisis de la incivilidad y deliberación presentes en comentarios de noticias online: el caso de Radio Bío Bío
Sociología,2019,UNIV.ALBERTO HURTADO,Nuevos repertorios de la acción pública: profesionales psicosociales en el contexto de la reforma a la justicia familiar y penal en Chile
Sociología,2019,UNIV.DE SANTIAGO DE CHILE,Ni en los medios ni en los journals: sobre cómo los saberes y las sensibilidades de los habitantes de las controversias socio-técnicas son invisibilizados y la posibilidad de reconocer su aporte
Sociología,2019,PONT. UNIV. CATOLICA DE VALPARAISO,Participación de no expertos en políticas públicas. El caso de los servicios locales de educación
Sociología,2019,UNIV.ANDRES BELLO,¿Del protagonismo a la abstención? Estudio sobre participación política en barrios populares del gran Santiago
Sociología,2019,UNIV.ALBERTO HURTADO,Determinantes institucionales y políticos del conflicto entre empresarios y trabajadores: los casos de argentina y Chile en perspectiva comparada
Sociología,2019,PONT. UNIV. CATOLICA DE CHILE,"Micropolitics of care: logics, practices, and engagements related to mental health diagnoses and special educational needs in chilean schools"
Sociología,2019,PONT. UNIV. CATOLICA DE CHILE,Masculinidades jóvenes y salud en el contexto actual del aumento del VIH en Chile
Sociología,2019,PONT. UNIV. CATOLICA DE CHILE,Traducción en la implementación de políticas sociales. El rol clave de los equipos locales
Sociología,2019,UNIV.ALBERTO HURTADO,"Gobernanza adaptativa ante mega incendios forestales: el caso del sistema socioecológico de Empedrado, Cauquenes, Constitución y San Javier"
Sociología,2019,PONT. UNIV. CATOLICA DE CHILE,Ciudadanía juvenil: entre la reproducción social y la socialización política
Sociología,2019,UNIV.AUSTRAL DE CHILE,Sophia 2.0: robust methods based on computational linguistics and machine learning to analyze media pluralism
Sociología,2019,UNIVERSIDAD VIÑA DEL MAR,La sociedad civil migrante. Un estudio sociológico y feminista desde las ciudades de Valparaíso y Arica
Sociología,2019,UNIV.AUTONOMA DE CHILE,Explaining clientelism in underprivileged Chile
Sociología,2019,PONT. UNIV. CATOLICA DE CHILE,"Re-contextualizando la desinstitucionalización psiquiátrica en Chile: procesos y tensiones locales, vínculos globales, y oportunidades de avance"
Sociología,2019,PONT. UNIV. CATOLICA DE CHILE,"La construcción mediática de la infancia: una aproximación desde lo informativo, lo publicitario y lo institucional"
Sociología,2019,UNIV.DE CHILE,El problema de la autoridad desde la perspectiva de los niños(as): análisis crítico del discurso de niños y niñas de tres estratos socioeconómicos de Santiago de Chile sobre las relaciones de autoridad con el mundo adulto
Educación,2010,PONT. UNIV. CATOLICA DE CHILE,ESTUDIO COMPARATIVO DE DISCURSOS DE INTERNACIONALIZACION DEL CURRICULUM EN UNIVERSIDADES CHILENAS
Educación,2010,UNIV.DE CONCEPCION,INCUBANDO CAPITAL HUMANO REGIONAL: EVALUACION LONGITUDINAL DE UN PROGRAMA EXTRA-CURRICULAR UNIVERSITARIO PARA ESTUDIANTES DE ESTABLECIMIENTOS MUNICIPALES DE ALTO POTENCIAL ACADEMICO.
Educación,2010,UNIV.DE LA FRONTERA,HACIA UN APRENDIZAJE DE CALIDAD EN LA EDUCACION CIENTIFICA. ESTRATEGIAS DIDACTICAS PARA EL DESARROLLO DE CAPACIDADES Y VALORES.
Educación,2010,PONT. UNIV. CATOLICA DE CHILE,"ELABORACION, APLICACION Y EVALUACION DE UN PROGRAMA DE DESARROLLO SOCIAL Y EMOCIONAL PARA ESTUDIANTES DE 5° Y 6° AÑO DE EDUCACION GENERAL BASICA."
Educación,2010,PONT. UNIV. CATOLICA DE CHILE,VISIBILIZACION DE LAS CONSTRUCCIONES DISCURSIVAS DE LA INCLUSION Y LA EXCLUSION: UN CAMINO HACIA POLITICAS Y PRACTICAS INCLUSIVAS
Educación,2010,UNIV.DE CHILE,THE EDUCATION QUALITY IN CHILE: A FOLLOW-UP STUDY IN A MULTICAUSAL APPROACH
Educación,2010,PONT. UNIV. CATOLICA DE CHILE,DESARROLLO Y VALIDACION DE UN INSTRUMENTO DE MEDICION DEL AMBIENTE EDUCACIONAL EN EL PROCESO DE APRENDIZAJE EN PROGRAMAS DE POSGRADO EN MEDICINA AMBULATORIA.
Educación,2010,PONT. UNIV. CATOLICA DE CHILE,"GESTION DIRECTIVA DE LICEOS DE ENSEÑANZA MEDIA TECNICO PROFESIONAL Y LOGRO DE OBJETIVOS ACADEMICOS. DIAGNOSTICO Y PROPUESTA DE SISTEMA DE ESTRATEGIAS DE GESTION, INNOVADORAS E INCLUSIVAS."
Educación,2010,PONT. UNIV. CATOLICA DE CHILE,ESTUDIO LONGITUDINAL DE PREDICTORES Y MODERADORES EDUCACIONALES DEL DESARROLLO DE LA ESCRITURA EN ESTUDIANTES UNIVERSITARIOS
Educación,2010,UNIV.DIEGO PORTALES,"IDENTIFICACION DE VARIABLES PREDICTORAS DE INTIMIDACION (BULLYING) ENTRE ESTUDIANTES. ANALISIS MULTI-NIVEL DE VARIABLES INDIVIDUALES, FAMILIARES Y ESCOLARES"
Educación,2010,PONT. UNIV. CATOLICA DE CHILE,"ESTUDIO DEL IMPACTO DEL PERSONAL EDUCATIVO EN EL APEGO, TEORIA DE LA MENTE, BIENESTAR SOCIOEMOCIONAL Y DESARROLLO PSICOMOTOR DE NIÑOS PREESCOLARES DE 3 A 5 AÑOS, SEGUN EL NIVEL DE RIESGO PSICOSOCIAL Y LAS CARACTERISTICAS DE SU CUIDADOR PRIN"
Educación,2010,PONT. UNIV. CATOLICA DE CHILE,"LA CONDUCCION DE PROCESOS DE ENSEÑANZA APRENDIZAJE DE PROFESORES NOVATOS: ¿A MAYORES Y MEJORES OPORTUNIDADES DE PRACTICA EN LA FORMACION INICIAL, MEJORES NIVELES DE DESEMPEÑO?"
Educación,2010,UNIV.AUSTRAL DE CHILE,IMPACTO DE LA FORMACION PERMANENTE DE PROFESORES SOBRE EL APRENDIZAJE ESCOLAR: UN ANALISIS DESDE LOS ACTORES INVOLUCRADOS
Educación,2010,UNIV.ALBERTO HURTADO,"EFECTO DEL USO DE ARGUMENTACION EN EL AULA EN EL DESARROLLO DE ALFABETIZACION CIENTIFICA, APRENDIZAJE DE CIENCIA Y DESARROLLO DE LA ARGUMENTACION."
Educación,2010,UNIV.ALBERTO HURTADO,ANALISIS DE LAS JUSTIFICACIONES QUE DAN LOS LIBROS DE TEXTO CHILENOS DE MATEMATICAS DEL PRIMER DECENIO DEL SIGLO XXI A LAS PROPIEDADES Y A LOS ALGORITMOS DEL AMBITO NUMERICO Y ALGEBRAICO. UN ANALISIS DE LA TRANSPOSICION DIDACTICA.
Educación,2010,UNIV.ACADEMIA DE HUMANISMO CRISTIANO,"RECONOCIMIENTO DEL ESPACIO ESCOLAR: UNA MIRADA DE CASOS, A LOS MECANISMOS LEGITIMADORES Y ANULADORES DE LA EXPERIENCIA ESPACIAL EN LICEOS DEL GRAN SANTIAGO."
Educación,2010,PONT. UNIV. CATOLICA DE CHILE,"THE TEACHING-RESEARCH NEXUS AND INQUIRY-BASED ""BLENDED"" LEARNING IN UNDEGRADUATE UNIVERSITY EDUCATION"
Educación,2010,PONT. UNIV. CATOLICA DE VALPARAISO,"CREENCIAS SOBRE CIENCIA, SU ENSEÑANZA Y APRENDIZAJE EN EDUCADORES DE PARVULOS Y SU INFLUENCIA EN LA IMPLEMENTACION DEL PROGRAMA TUS COMPETENCIAS EN CIENCIAS (TCC)."
Educación,2010,PONT. UNIV. CATOLICA DE CHILE,INFLUENCIA DEL LIDERAZGO INSTRUCCIONAL EN MOTIVACION Y LOGROACADEMICO EN ESTUDIANTES SECUNDARIOS.
Educación,2011,UNIV.DE CHILE,"ELABORACION, APLICACION Y EVALUACION DE UN PROGRAMA DE INTERVENCION CON MATERIALES EDUCATIVOS EN ALIMENTACION SALUDABLE PARA PROFESORES, ALUMNOS DE PREBASICA, BASICA Y SUS FAMILIAS."
Educación,2011,PONT. UNIV. CATOLICA DE CHILE,"ANALISIS DESDE UNA PERSPECTIVA EVOLUTIVA Y CULTURAL DEL USO DE LA COMUNICACION GESTUAL EN INFANTES Y PRE-ESCOLARES, EN LA EXPRESION Y COMPRENSION DE LOS ESTADOS INTERNOS Y SU IMPACTO EN EL DESARROLLO SOCIO-EMOCIONAL DE LOS NIÑOS(AS)."
Educación,2011,UNIV.CATOLICA DE LA STMA. CONCEPCION,REQUERIMIENTOS PROFESIONALES DE FORMACION INICIAL DE PROFESORES PARA UN DESEMPEÑO DE CALIDAD EN CONTEXTOS DE VULNERABILIDAD SOCIAL Y ECONOMICA
Educación,2011,PONT. UNIV. CATOLICA DE CHILE,SCHOOL EFFECTIVENESS AND VALUE ADDED MODELS: FROM QUANTITATIVE ANALYSIS TO QUALITATIVE OUTCOMES
Educación,2011,UNIV.DE SANTIAGO DE CHILE,INTERACCION DIDACTICA EN SALA DE CLASE EN CONTEXTOS ESCOLARES DE ALTO DESEMPEÑO: LA CONSTRUCCION DE CONOCIMIENTO ESCOLAR Y PROCESOS COGNITIVOS.
Educación,2011,UNIV.DE CONCEPCION,PRACTICAS PEDAGOGICAS EN DOCENTES NO PEDAGOGOS QUE SE DESEMPEÑAN EN PROGRAMAS DE PREGRADO DE UNIVERSIDADES DE LA ZONA CENTRO-SUR DE CHILE
Educación,2011,UNIV.CATOLICA DE TEMUCO,"EPISTEMOLOGIA DEL CONOCIMIENTO MAPUCHE Y EL ESCOLAR: UN ANALISIS DESDE LA PEDAGOGIA INTERCULTURAL, LA GEOGRAFIA Y SOCIOLOGIA EDUCACIONAL"
Educación,2011,PONT. UNIV. CATOLICA DE VALPARAISO,LA CONTRIBUCION DE LOS CENTROS DE PRACTICA A LA FORMACION INICIAL DOCENTE: PERSPECTIVAS DE DOCENTES DE AULA Y DOCENTES DIRECTIVOS
Educación,2011,UNIV.DE LA SERENA,ASOMBROS EDUCATIVOS INFANTILES Y PROPENSION A APRENDER.
Educación,2011,PONT. UNIV. CATOLICA DE CHILE,"IDENTIFICACION, CARACTERIZACION Y EVALUACION DE COMPETENCIAS DE PENSAMIENTO CIENTIFICO EN PROFESORES DE CIENCIA EN FORMACION A TRAVES DEL ENFRENTAMIENTO A LA SOLUCION DE PROBLEMAS. SU APORTE AL DESARROLLO Y CALIDAD DE LA PROFESIONALIDAD DOC"
Educación,2011,PONT. UNIV. CATOLICA DE CHILE,"TIEMPO ESCOLAR, INTERCAMBIOS Y EXIGENCIA COGNITIVA EN AULAS DE CLASE CON ALTO Y BAJO SIMCE EN SEGUNDO CICLO DE E. BASICA."
Educación,2011,UNIV.CATOLICA DE TEMUCO,TIPIFICACION DE LOS METODOS EDUCATIVOS MAPUCHES: BASES PARA UNA EDUCACION INTERCULTURAL
Educación,2011,UNIV.DE LA FRONTERA,"DISEÑO, VALIDACION Y EVALUACION DE UN MODELO PEDAGOGICO DE ALFABETIZACION ECONOMICA EN LA FORMACION INICIAL DE PROFESORES."
Educación,2011,PONT. UNIV. CATOLICA DE VALPARAISO,ESTUDIO DE LA EFECTIVIDAD DEL USO DE LA INDAGACION Y DE UN NUEVO METODO DE ADQUISICION DE COORDENADAS DE OBJETOS EN MOVIMIENTO EN EL LOGRO DE UN APRENDIZAJE SIGNIFICATIVO DE CONCEPTOS BASICOS DE CINEMATICA Y DINAMICA.
Educación,2011,UNIV.DE CONCEPCION,FACTORES PERSONALES Y ACADEMICOS QUE INFLUYEN EN EL DESARROLLO DEL APRENDIZAJE AUTODIRIGIDO DE LOS ALUMNOS DE MEDICINA DURANTE EL PRIMER AÑO.
Educación,2011,PONT. UNIV. CATOLICA DE CHILE,PREDICTORES TEMPRANOS DE LA COMPRENSION LECTORA. ¿QUIENES ESTAN EN RIESGO DE PRESENTAR PROBLEMAS?
Educación,2011,UNIV.DE CONCEPCION,ALFABETIZACION ACADEMICA: EL HIPERTEXTO UNA HERRAMIENTA PARA MEJORAR LOS APRENDIZAJES EN LA FORMACION DE PROFESORES
Educación,2011,PONT. UNIV. CATOLICA DE CHILE,A PROMISE FOR THE FUTURE: 10-YEAR FOLLOW-UP STUDY OF CHILEAN ADOLESCENTS WITH HIGH ACADEMIC ABILITIES AND LOW SOCIAL-ECONOMICAL STATUS
Educación,2011,PONT. UNIV. CATOLICA DE CHILE,IMPACTO DE UN PROGRAMA DE DESARROLLO DE LA MEMORIA OPERATIVA EN NIÑOS Y NIÑAS QUE ASISTEN A JARDINES INFANTILES DE ZONAS RURALES Y URBANAS.
Educación,2011,PONT. UNIV. CATOLICA DE VALPARAISO,THE PRACTICES OF NOVELS TEACHERS: IS HIS EPISTEMOLOGIA STABLE?
Educación,2011,PONT. UNIV. CATOLICA DE VALPARAISO,TALLER DE DIDACTICA DE LA MATEMATICA:UNA ACTIVIDAD CURRICULAR INNOVADORA PARA LA FORMACION DE PROFESORES BASICOS Y EDUCADORAS DE PARVULOS. VALIDACION DE CONSTRUCTOS Y HERRAMIENTAS PARA LA FORMACION INICIAL DOCENTE
Educación,2011,UNIV.METROPOLITANA DE CS.DE LA EDUCACION,"SISTEMAS DE CONOCIMIENTO QUE SOBRE EL APRENDIZAJE, LA EDUCACION Y LA ESCUELA COMPARTEN FAMILIAS DE COMUNIDADES INDIGENAS DEL NORTE Y DEL SUR DE CHILE: UN APORTE A LA CONSTRUCCION DE UNA DIMENSION INTERCULTURAL PARA EL CURRICUL"
Educación,2011,PONT. UNIV. CATOLICA DE VALPARAISO,LA EDUCACION FISICA Y SU FUNCION DE TRANSFORMACION DE LAS DESIGUALDADES SOCIALES: PROFESORADO DEL AREA Y DOCUMENTACION MINISTERIAL
Educación,2011,PONT. UNIV. CATOLICA DE CHILE,VALIDACION EXPERIMENTAL DE SECUENCIAS DE ACTIVIDADES DIDACTICAS CON BASE EN EL CICLO CONSTRUCTIVISTA DEL APRENDIZAJE QUE PROMUEVEN LA ALFABETIZACION CIENTIFICA
Educación,2011,UNIV.DE LA SERENA,"CONTEXTUALIZACION Y APLICACION DE UN MODELO CONCEPTUAL-METODOLOGICO PARA LA ENSEÑANZA-APRENDIZAJE DEL DESARROLLO RURAL SUSTENTABLE, DESDE LA PERSPECTIVA GEOGRAFICA."
Educación,2011,UNIV.DE VALPARAISO,¿QUE SIGNIFICA SER UN ACADEMICO UNIVERSITARIO?: CONSTRUCCION DE IDENTIDADES EN LA UNIVERSIDAD DEL SIGLO XXI.
Educación,2011,UNIV.DE TALCA,"ANALISIS DE LAS PRACTICAS INSTRUCCIONALES EN TORNO A LA TAREA DE COMPRENSION DE TEXTOS, A PARTIR DE LA EVIDENCIA AUDIOVISUAL DE LA EVALUACION DOCENTE, EN CLASES DE LENGUAJE DEL SEGUNDO CICLO DE EDUCACION BASICA."
Educación,2011,UNIV.AUSTRAL DE CHILE,IMPACTOS Y CONTRA-IMPACTOS IDENTITARIOS EN LA EVALUACION DEL DESEMPEÑO DE PROFESORES DE EDUCACION MATEMATICA Y DE LENGUAJE Y COMUNICACION.
Educación,2011,UNIV.CATOLICA DEL MAULE,EVALUACION DE LA SENSIBILIDAD INTERCULTURAL EN ALUMNOS(AS) DE EDUCACION BASICA Y MEDIA ESCOLARIZADOS EN AULAS CULTURALMENTE DIVERSAS: DIAGNOSTICO Y DESAFIOS PARA EL SISTEMA EDUCATIVO DE CHILE
Educación,2011,PONT. UNIV. CATOLICA DE CHILE,EL ROL DE LAS VARIABLES PERSONALES Y DEL CONTEXTO EN LA CALIDAD DOCENTE.
Educación,2011,PONT. UNIV. CATOLICA DE VALPARAISO,CUANDO LA ESCUELA RURAL SE CIERRA: PROCESOS PSICOSOCIALES A NIVEL COMUNITARIO A PARTIR DEL CIERRE Y FUSION DE ESCUELAS RURALES EN LA SEXTA REGION
Educación,2011,UNIV.DE CHILE,"MODELOS PARA EL ESTUDIO, DISEÑO Y ANALISIS DE AMBIENTES DE ENSEÑANZA-APRENDIZAJES ASISTIDOS POR TECNOLOGIAS DE INFORMACION Y COMUNICACION"
Educación,2011,PONT. UNIV. CATOLICA DE VALPARAISO,CREENCIAS SOBRE LO QUE ES INNOVAR Y SU INFLUENCIA SOBRE LO QUE SE PIENSA Y HACE CON TICS EN LA ENSEÑANZA Y EL APRENDIZAJE: CARACTERIZANDO LAS VARIACIONES QUE PRESENTAN DOCENTES Y ESTUDIANTES DE CARRERAS DE PEDAGOGIA.
Educación,2012,UNIV.DE TALCA,"CONFLICTOS, TENSIONES Y EQUILIBRIO ENTRE LAS VISIONES DOMINANTES DE LA POLITICA EDUCACIONAL EN LA TRANSICION CHILENA (1990 -2010)"
Educación,2012,UNIV.DE CONCEPCION,"INVESTIGACION DEL CONOCIMIENTO PROFESIONAL, LAS CREENCIAS IMPLICITAS Y EL DESEMPEÑO EN AULA DE ESTUDIANTES DE PEDAGOGIA EN INGLES COMO ESTRATEGIA DE GENERACION DE INDICADORES DE MONITOREO DE SU PROCESO FORMATIVO ."
Educación,2012,UNIV.DE CHILE,MAPAS MENTALES PARA LA NAVEGACION A TRAVES DE VIDEOJUEGOS
