grupo estudio,year,universidad,titulo
Sociología,2016,UNIV.DE CHILE,"Hacia una sociología de la cultura popular ausente. Corporalidad, representación y mediatización de 'lo popular reprimido' y 'lo popular no representado' en Santiago de Chile (1810-1925)"
Sociología,2016,UNIV.ANDRES BELLO,"Antecedent social factors of moral behaviour: expectations, decisions and justificatory principles in social dilemmas"
Sociología,2017,UNIV.DE VALPARAISO,"Análisis, validación y evaluación de un modelo de colaboración familia-escuela para la promoción del involucramiento familiar y el desarrollo integral de la niñez. Desde la literatura científica internacional a la generación de evidencia en Chile"
Sociología,2017,UNIV.ALBERTO HURTADO,Entierrando el antropoceno: ensamblando nuevos ecosistemas desde suelos degradados en la región de Atacama
Sociología,2017,PONT. UNIV. CATOLICA DE CHILE,Transcurso y metamorfosis de la cobertura informativa de desastres: alteraciones y modificaciones de los objetivos informativos en las distintas fases y tipos de desastres
Sociología,2017,UNIV.DIEGO PORTALES,Inclusión digital móvil: oportunidades y desafíos del acceso y uso de internet a través del teléfono en Chile
Sociología,2017,UNIV.AUTONOMA DE CHILE,"Las elites académicas universitarias en Chile. Un estudio sobre los perfiles, vivencias y percepciones sobre el éxito del alumnado y el rol de las instituciones universitarias de élite en los procesos de reproducción y movilidad social"
Sociología,2017,UNIV.DE CHILE,Acción pública y diversidad sexual en Chile: construcciones sociales en democracia (1990-2016)
Sociología,2017,UNIV.ALBERTO HURTADO,"La gubernamentalidad del sistema educacional chileno y su dispositivo evaluador: redes de producción, decisiones controversiales y efectos performativos (1968-2019)"
Sociología,2017,UNIV.CENTRAL DE CHILE,Condiciones institucionales y consecuencias subjetivas de la producción del estatus legal precario en los migrantes en Chile
Sociología,2017,UNIV.DE TARAPACA,Envejecimiento en el lugar: la influencia del ambiente residencial y la pertenencia étnica en el envejecimiento exitoso en personas mayores aymaras y mapuches de Chile
Sociología,2017,FUND CENT TRANSDISCIPLINARIO DE ESTUDIOS,Modelos conceptuales del sistema complejo sociedad-naturaleza: abriendo caminos hacia nuevas formas de construcción del desarrollo rural en Chile
Sociología,2017,PONT. UNIV. CATOLICA DE CHILE,"Recursos melodramáticas y noticias televisivas: activación, disfrute identificación y contagio emocional como elementos explicadores de los efectos del melodrama sobre la recordación y comprensión de información"
Sociología,2017,PONT. UNIV. CATOLICA DE CHILE,Cambios en los debates presidenciales en televisión en Chile (1989 - 2017): el rol de los periodistas y el contenido de las respuestas de los candidatos
Sociología,2017,UNIV.BERNARDO O'HIGGINS,"Múltiples violencias que afectan a las niñas y los niños migrantes en Chile: derechos, intervenciones sociales y políticas públicas"
Sociología,2017,UNIV.DIEGO PORTALES,Expanding social indicators research: the quality of employment in developing countries
Sociología,2017,PONT. UNIV. CATOLICA DE CHILE,Comprendiendo la dinámica de la abuelidad y su relación con el bienestar de las personas mayores en Chile
Sociología,2017,UNIV.DIEGO PORTALES,"Justicia, legitimidad y cambio social: acerca de la interacción entre justicia distributiva y procedimental"
Sociología,2017,UNIV.ALBERTO HURTADO,Subjetividades en el trabajo en red: las identidades laborales de trabajadores de redes surgidas de alianzas público-privadas (redes app) en Chile
Sociología,2017,UNIV.DE LA FRONTERA,Efectos locales de la compra de tierras a comunidades mapuche en la Araucanía: un análisis socioecológico y de calidad de vida humana
Sociología,2017,UNIV.DE SANTIAGO DE CHILE,La estructura de la sociabilidad en Chile y sus consecuencias para nuestra convivencia. Análisis longitudinal de redes sociales
Sociología,2017,UNIV.DE CHILE,"Trayectorias, oportunidades y expectativas educacionales post-secundarias de jóvenes chilenos. Hacia una comprensión del soporte socio-cultural del mercado de la educación superior"
Sociología,2018,UNIV.CATOLICA DEL NORTE,Segregación ocupacional por sexo: etnografía de las interacciones simbólicas y no simbólicas en la formación técnica y/o universitaria para la minería mixta del 2035
Sociología,2018,UNIV.DE PLAYA ANCHA CS. EDUCACION,Reformas judiciales y acceso a la justicia en Chile: desde la sociología del actuar y la recepción judicial (2000-2020)
Sociología,2018,UNIV.CATOLICA DEL NORTE,Mercantilización de las emociones. El lugar simbólico de las trabajadoras sexuales en las emociones de los hombres de la gran minería del cobre
Sociología,2018,UNIV.DIEGO PORTALES,La vida social de las prácticas y tecnologías para el consumo sustentable: una mirada sociológica a la autogeneración energética y el reciclaje doméstico
Sociología,2018,UNIV.ANDRES BELLO,"El trabajo científico en Chile: instrumentos de acción pública, prácticas de producción científica e identidades laborales"
Sociología,2018,UNIV.CATOLICA DEL NORTE,Análisis del impacto relativo del sistema de ciencia chileno 2010-2017. Un enfoque libre de escala
Sociología,2018,UNIV.DE SANTIAGO DE CHILE,Problematizaciones del individualismo en América del Sur
Sociología,2018,UNIV.ALBERTO HURTADO,"Nuevas mercancías y servicios religiosos en Santiago: prácticas, consumo y resignificaciones de lo sagrado"
Sociología,2018,PONT. UNIV. CATOLICA DE VALPARAISO,"Prácticas, discursos y redefinición de roles periodísticos en redes sociales: un estudio comparado en las plataformas digitales de Twitter e Instagram"
Sociología,2018,UNIV.DE LOS LAGOS,¿De la dispersión a la acumulación? Consecuencias políticas de los conflictos socio-territoriales en perspectiva comparada (Chile-Perú)
Sociología,2018,UNIV.SANTO TOMAS,"Fracturas al orden de género en la gran minería en Chile: trayectorias personales y ocupacionales de mujeres en cargos no tradicionales, ejecutivos u operarios, analizados desde la interseccionalidad"
Sociología,2018,UNIV.DE VALPARAISO,Análisis de los discursos de jóvenes universitarios que participan y no participan en manifestaciones estudiantiles de Santiago y Valparaíso acerca de la legitimidad del sistema y la legitimidad de las acciones de protesta del movimiento estudiantil
Sociología,2018,UNIV.ALBERTO HURTADO,Intereses y controversias en torno al agua. Los grupos de interés y la reforma al código de aguas
Sociología,2018,UNIV.DE LA FRONTERA,El imaginario social de la nación en la crítica literaria periodística publicada en la prensa chilena durante el periodo de la unidad popular (1970-1973)
Sociología,2018,UNIV.MAYOR,Can society turn wine into water? Cross-national life-course research on the social variations in the association between drinking behavior and healthy aging
Sociología,2018,UNIV.DIEGO PORTALES,"Trabajo y construcción de identidades en trabajadores de la industria del retail en Chile. Estudio en 3 ciudades sobre contextos regionales productivos, narrativas identitarias, formas de reconocimiento, control managerial y organización sindical"
Sociología,2018,UNIV.DE SANTIAGO DE CHILE,La producción del conocimiento sociotécnico en contextos de evaluación ambiental
Sociología,2018,UNIV.DIEGO PORTALES,Socialización política y educación para la ciudadanía: el rol de la familia y de la escuela
Sociología,2018,UNIV.DE CHILE,Memorias políticas que activistas de diferentes generaciones construyen sobre la politización de la sociedad chilena en el pasado reciente
Sociología,2018,PONT. UNIV. CATOLICA DE CHILE,"Parenting at the crossroads: a study of early childhood, care and mobility in an intercultural context in Santiago de Chile"
Sociología,2018,UNIV.ANDRES BELLO,The institutional basis of subjective wellbeing: understanding the role of trust in the criminal justice system and ontological security in comparative perspective
Sociología,2018,UNIV.DIEGO PORTALES,Constitución política y reprogramación del orden social: un estudio sobre la producción de conceptos de sociedad en la discusión y redacción de la constitución chilena de 1980
Sociología,2018,PONT. UNIV. CATOLICA DE CHILE,Riesgos y oportunidades del uso de tics en escolares: hacia una agenda de alfabetización digital para el alumno 2020
Sociología,2018,UNIV.ARTURO PRAT,Cadenas transfronterizas de cuidado entre Chile y Bolivia: trabajo de cuidado y emociones en un contexto de movilidad circular
Sociología,2019,UNIV.AUTONOMA DE CHILE,"Jóvenes, trabajo y familia: hacia un modelo para la comprensión de expectativas familiares y laborales"
Sociología,2019,UNIV.DE CONCEPCION,Comunalización y heterogeneidades económicas: espacios de diálogo en torno a casos en el centro sur de Chile
Sociología,2019,UNIV.DIEGO PORTALES,Comparación espacio-temporal de la participación cultural y el gusto. El caso de Chile
Sociología,2019,UNIV.ARTURO PRAT,La intermediación urbano-portuaria en un contexto transfronterizo: Arica (2008-2018)
Sociología,2019,FUND. PARA LA INV. DEPRESION Y PERS.,Infancia institucionalizada y vida cotidiana de la niñez en las residencias de protección de Santiago de Chile (1979-2000)
Sociología,2019,UNIV.DE CHILE,Estudio longitudinal de trayectorias y transiciones investigativas de trabajadores sociales chilenos
Sociología,2019,UNIV.ADOLFO IBANEZ,"Gobernando transiciones críticas en sistemas socioecológicos: el caso de Chiloé, Chile"
Sociología,2019,UNIV.CATOLICA DE TEMUCO,"Tecno política mapuche. Redes de comunicación, interculturalidad y heteronomía desde el wallmapu"
Sociología,2019,UNIV.DE LA FRONTERA,"Calidad del aire, vulnerabilidad social y percepción de riesgo en ciudades intermedias del sur de Chile: un análisis desde la justicia ambiental"
Sociología,2019,UNIV.DE LOS LAGOS,La posición de uno mismo en la sociedad: lo justo y lo injusto en el espejo social
Sociología,2019,PONT. UNIV. CATOLICA DE CHILE,Fecundidad adolescente y resultados educativos en Chile
Sociología,2019,PONT. UNIV. CATOLICA DE CHILE,Naturalezas equívocas: disensos ontológicos y las transiciones hacia la sustentabilidad
Sociología,2019,UNIV.DIEGO PORTALES,Inmigración en Chile: cobertura e impacto de los contenidos difundidos por los medios de comunicación en las percepciones de las audiencias
Sociología,2019,UNIV.ANDRES BELLO,Doing laboratory studies in Chile: re-engaging science in the making and the established field of science and technology studies
Sociología,2019,UNIV.DIEGO PORTALES,Confianza relacional en la educación media. Un estudio en establecimientos científico-humanistas y técnico-profesionales de la región metropolitana
Sociología,2019,UNIV.ACADEMIA DE HUMANISMO CRISTIANO,"Género, etnia y nacionalidad en los asalariados temporales de la fruticultura de exportación. Una inmersión en trayectorias sociales frente a estrategias empresariales de empleo en Atacama y La Araucanía"
Sociología,2019,UNIV.ALBERTO HURTADO,"Más allá del paradigma de la víctima: genealogías de dispositivos de performación de sujetos de la violencia política. Chile, 1973-2018"
Sociología,2019,UNIV.DE CHILE,"Políticas (estatales) de empleo bajo el neoliberalismo y el buen vivir: encrucijadas para el desarrollo. Los casos de Bolivia, Brasil, Chile y ecuador (2014-2018)"
Sociología,2019,PONT. UNIV. CATOLICA DE VALPARAISO,Trabajo público en tiempos manageriales: prácticas cotidianas y formas de acción colectiva en contextos de alta rendición de cuentas y gobernanza financializada de lo público
Sociología,2019,UNIV.DE VALPARAISO,"De zonas de sacrificio a zonas de recuperación socioambiental: construcción participativa de criterios de gobernanza ambiental y bienestar en Las bahías-Puerto de Huasco, Puchuncaví-Quintero y Coronel, Chile"
Sociología,2019,PONT. UNIV. CATOLICA DE CHILE,"Repertorios culturales, trayectorias socio-espaciales y política: sobre la fragmentación y conflicto posicional en la clase media alta en Chile"
Sociología,2019,UNIV.ANDRES BELLO,"Desigualdad temporal, reproducción y exclusión social"
Sociología,2019,UNIV.CATOLICA CARDENAL SILVA HENRIQUEZ,¿Hacia un nuevo campo político?: organizaciones y discursos políticos emergentes en el Chile actual (2010-2010)
Sociología,2019,PONT. UNIV. CATOLICA DE CHILE,Economía moral de los desastres socionaturales y el Estado
Sociología,2019,UNIV.CATOLICA DE TEMUCO,Segregación de género en la elección de estudios superiores. Análisis de factores internos y externos que influyen en las trayectorias vocacionales de estudiantes secundarios/as chilenos/as
Sociología,2020,UNIV.DE SANTIAGO DE CHILE,Prácticas de mantención y reparación de infraestructuras remotas y el surgimiento de comunidades energéticas en Coyhaique y Puerto Edén
Sociología,2020,UNIV.DE CHILE,Formación de audiencias ciudadanas: adolescentes y telenovelas en tiempos de intolerancia
Sociología,2020,PONT. UNIV. CATOLICA DE CHILE,"¿Víctimas del neoliberalismo o aristocracia obrera? Explicando las variaciones en los movimientos laborales latinoamericanos, desde el consenso de Washington hasta Bolsonaro"
Sociología,2020,UNIV.ADOLFO IBANEZ,The autonomy and secularisation of modernity. A study in philosophical sociology
Sociología,2020,UNIV.DE CHILE,"Representaciones sociales de actores relevantes vinculadas con las principales barreras a las prestaciones garantizadas en la ley 21.030, que despenaliza la interrupción del embarazo por tres causales en Chile"
Sociología,2020,UNIV.CATOLICA CARDENAL SILVA HENRIQUEZ,"Democracia, política y redes corporativas en Chile. Una aproximación sociológica y metodológica al campo social e institucional de centros de estudios y think tanks (1990-2021)"
Sociología,2020,UNIV.DIEGO PORTALES,Capitalismo y legitimación de la democracia: el circuito global-local de producción y recepción de ideas a partir de la plataforma project syndicate
Sociología,2020,UNIV.ALBERTO HURTADO,Radiografía del pensamiento crítico latinoamericano: las antologías de clacso como aproximación a un canon regional
Sociología,2020,PONT. UNIV. CATOLICA DE CHILE,Vejez e interculturalidad: distancias y encuentros en un Chile diverso
Sociología,2020,UNIV.CATOLICA DE TEMUCO,"Precariedades del trabajo en la macrozona sur de Chile: intersecciones, territorios y resistencias en las regiones del Maule, Ñuble, Biobío y la Araucanía"
Sociología,2020,UNIV.ARTURO PRAT,"Migraciones y zona franca: empresarios, comerciantes y trabajadores extranjeros en la historia de zofri desde 1975 hasta hoy"
Sociología,2020,UNIV.CATOLICA DE LA STMA. CONCEPCION,"Communicating family identity through the web to improve consumer attention, brand attitude, and purchase intention"
Sociología,2020,UNIV.ALBERTO HURTADO,Rutas y trayectorias de migrantes venezolanos a lo largo de américa del sur. Cuando las puertas comienzan a cerrarse
Sociología,2020,UNIV.DE CHILE,Jóvenes de película: genealogía de la juventud a partir de la producción cinematográfica en Chile del siglo XX
Sociología,2020,UNIV.CATOLICA DE TEMUCO,Los gustos espaciales en la producción de espacios urbanos dentro del Chile neoliberal: el caso de las conurbaciones de Temuco-Padre las casas e Iquique-Alto Hospicio
Sociología,2020,UNIV.AUSTRAL DE CHILE,Ecologías de la reparación: crisis socioambientales como procesos de experimentación ontológica
Sociología,2020,PONT. UNIV. CATOLICA DE CHILE,"Jóvenes veganos en Santiago de Chile: una investigación sobre carreras desviadas, hábitus y prácticas socio-alimentarias"
Sociología,2020,UNIV.DE CHILE,Resistencias profesionales en la primera línea de implementación de programas sociales en Chile
Sociología,2020,UNIV.DE CHILE,Gramáticas de las microcontroversias a propósito del trastorno por déficit atencional e hiperactividad. Un estudio sobre los diferendos normativos suscitados en el marco de los actuales procesos civilizatorios en Chile
Sociología,2010,PONT. UNIV. CATOLICA DE CHILE,Participación ciudadana en contextos de desastre: una aproximación desde la sociología de las controversias
Sociología,2010,UNIV.DE LOS LAGOS,"Discriminación y lucha por el reconocimiento en el proceso de incorporación de los inmigrantes argentinos, peruanos y ecuatorianos a la región metropolitana"
Sociología,2010,UNIV.DIEGO PORTALES,Construyendo al consumidor de clase media. Un análisis de las prácticas de categorización social del marketing y la publicidad en Chile
Sociología,2010,UNIV.DIEGO PORTALES,Does the chilean pension model influence health and happiness? A multilevel longitudinal analysis
Sociología,2011,UNIV.DE CONCEPCION,Agroecología y agricultura orgánica en el centro-sur de Chile: cadenas de valor y redes de gobernanza
Sociología,2011,PONT. UNIV. CATOLICA DE CHILE,Three years after birth: family transitions and the wellbeing of chilean mothers
Sociología,2011,UNIV.DIEGO PORTALES,"Reproducción asistida en Chile: análisis de los repertorios culturales usados para evaluar lo correcto, moral y legitimo en el campo abierto por las nuevas tecnologías reproductivas"
Sociología,2011,CORPORACION RIMISP,Desigualdad territorial y transferencias condicionadas de ingreso: el caso del ingreso ético familiar
Sociología,2011,PONT. UNIV. CATOLICA DE VALPARAISO,Imaginarios sociales sobre el conflicto. Los sistemas de justificación del acuerdo y del disenso en las relaciones entre los actores de enseñanza media
Sociología,2011,UNIV.CATOLICA DEL MAULE,Genealogía de lo juvenil en Chile en el siglo XX. Políticas de visibilidad y emergencias identitarias (c.1906-c.1986)
Sociología,2011,UNIV.DIEGO PORTALES,Trabajo y maternidad: estudio biográfico interpretativo sobre la articulación del ámbito laboral y familiar en mujeres con hijos en la primera infancia
Sociología,2011,UNIV.ALBERTO HURTADO,Individuos y regímenes pragmáticos en Chile: hacia una sociología pragmática y moral del individuo
Sociología,2011,UNIV.AUSTRAL DE CHILE,"La sociología del cambio climático: políticas públicas, trayectorias regionales y representaciones sociales del cambio climático en el sur de Chile"
Sociología,2011,UNIV.DE VALPARAISO,"Academic identities and practice in changing institutional contexts of chilean higher education: the case of sociology, education and biology"
Sociología,2012,UNIV.DE LOS LAGOS,Efectos de la multiadhesion en el comportamiento cívico de los jóvenes
Sociología,2012,UNIV.DE ANTOFAGASTA,Una mirada a la responsabilidad social universitaria en la ciudad de Antofagasta
Sociología,2012,PONT. UNIV. CATOLICA DE CHILE,La difusión de la protesta colectiva en Chile (2000-2011)
Sociología,2012,UNIV.CATOLICA DEL MAULE,Factores socioculturales que conforman la opinión publica y especializada de los roles sociales de las personas mayores de Chile en el periodo 2002-2012
Sociología,2012,UNIV.DE PLAYA ANCHA CS. EDUCACION,A sociology of the chilean public administration: the court clerks and the criminal procedure reform
Sociología,2012,PONT. UNIV. CATOLICA DE CHILE,Social justice and citizenship participation: an international comparison with focus on the case of Chile
Sociología,2012,UNIV.DE SANTIAGO DE CHILE,"El pensamiento de los intelectuales indígenas en la historia reciente de América Latina y Chile, 1980-2010"
Sociología,2012,UNIV.ALBERTO HURTADO,Cooptación de movimientos regionalistas en tres coyunturas históricas de Chile: modelo y fragilidad de alianza regionalizadora
Sociología,2012,UNIV. UCINF,La infancia como sujeto de las políticas públicas e intervenciones sociales: el caso de la niñez migrante en el Chile del siglo XXI
Sociología,2012,UNIV.DIEGO PORTALES,Pensar la negatividad de lo social: hacia una reconstrucción del concepto de ruptura en la teoría social moderna
Sociología,2012,UNIV.ALBERTO HURTADO,"Género, relaciones laborales y organizaciones académicas. Prácticas y discursos en las universidades chilenas"
Sociología,2012,UNIV.DE SANTIAGO DE CHILE,"Plataformas ciudadanas y grupos de conocimiento experto en la conformación de marcos interpretativos en torno a la generación eléctrica ""de base"" en Chile entre 2008 y 2011"
Sociología,2013,UNIV.ACADEMIA DE HUMANISMO CRISTIANO,El discurso de la igualdad de género en Chile y su recepción en mujeres de las capas medias y altas
Sociología,2013,UNIV.DE PLAYA ANCHA CS. EDUCACION,Acción colectiva y diseño institucional. Una contribución desde la sociología analítica al estudio de los fundamentos y de las consecuencias de la des-colectivizacion en Chile
Sociología,2013,UNIV.ADOLFO IBANEZ,The academic collection of self-reports:from opinion polls to household panel surveys (1960s-2000s)
Sociología,2013,UNIV.DIEGO PORTALES,Procesos de construcción de identidad en el trabajo en el Chile actual: el caso de los trabajadores de tiendas de grandes empresas del retail. Aportes empíricos y conceptuales al debate sobre trabajo e identidad en América Latina
Sociología,2013,UNIV.DE SANTIAGO DE CHILE,Análisis de la segregación escolar socioeconómica en enseñanza básica
Sociología,2013,UNIV.DE LOS LAGOS,"Sociología de la agricultura familiar en Chile: diversidad, agencia y estilos agrarios"
Sociología,2013,UNIV.CENTRAL DE CHILE,"Las tecnologías sociales de las organizaciones económicas de medios sociales urbanos pobres. El caso de los cachureros y coleros de Huechuraba, región metropolitana, Chile"
Sociología,2013,UNIV.DE CONCEPCION,"Patrimonio cultural, territorio y desarrollo local: análisis de los procesos de apropiación social del discurso patrimonial, su articulación con políticas públicas y efectos en las dinámicas de desarrollo local, en tres regiones del sur"
Sociología,2013,UNIV.DE CONCEPCION,Hacia la configuración de nuevas masculinidades: relaciones de género y arreglos domésticos en las familias del Concepción urbano
Sociología,2013,UNIV.DE CONCEPCION,"Imaginarios sociales de la identidad mapuche en el gran Concepción, región del Biobío"
Sociología,2013,PONT. UNIV. CATOLICA DE CHILE,Trayectorias y memoria de investigación: testimonios y aproximaciones narrativas a la investigación en trabajo social
Sociología,2013,UNIV.ANDRES BELLO,"Fragilidad social en el adulto mayor: factores asociados y su relación con discapacidad, muerte, uso de servicios de salud y calidad de vida"
Sociología,2013,UNIV.ANDRES BELLO,Determinantes sociales para la adherencia al tamizaje de cáncer cervicouterino
Sociología,2013,UNIV.CATOLICA DE LA STMA. CONCEPCION,Modelos de guion en el cine chileno de ficción: análisis de los estándares profesionales y los principios dramatúrgicos aplicados por la industria audiovisual durante el periodo 2003 - 2013
Sociología,2013,UNIV.DE VALPARAISO,Discursos sobre la política y la democracia y formas de acción política no convencionales de estudiantes universitarios que participan en distintas formas de asociatividad juvenil
Sociología,2014,UNIV.DE TARAPACA,"Envejecimiento con éxito, apoyo social y etnicidad en personas mayores de la región de Arica y Parinacota"
Sociología,2014,UNIV.ACADEMIA DE HUMANISMO CRISTIANO,¿Iguales ante la ley?: inclusión y exclusión de formas familiares en el derecho chileno
Sociología,2014,UNIV.DIEGO PORTALES,"Descentralización cultural y construcción de identidad territorial: el lugar de lo indígena en las políticas culturales de las regiones del Bío bío, La Araucanía y Los Lagos"
Sociología,2014,UNIV.CATOLICA DE TEMUCO,"Apropiación tecnológica, discurso y decolonialidad. La producción informativa digital mapuche en el marco del conflicto estado-nación y pueblo mapuche en la región de La Araucanía"
Sociología,2014,UNIV.SANTO TOMAS,Significados y experiencias de la niñez y vejez como polos vitales de cuidado en familias del medio rural del valle de Aconcagua. Una lectura desde la perspectiva de género
Sociología,2014,UNIV.AUTONOMA DE CHILE,"La excelencia académica en escuelas públicas de prestigio: percepciones, vivencias y prácticas de los actores escolares"
Sociología,2014,UNIV.CATOLICA CARDENAL SILVA HENRIQUEZ,"Generaciones, cultura militante y faccionalismo en los partidos socialista y demócrata cristiano de Chile. Cambios contemporáneos en las nociones de la política, El partido y su vinculación con la sociedad. 1973-2015"
Sociología,2014,UNIV.ALBERTO HURTADO,"Sur y la construcción del anti-movimiento de pobladores: ciencias sociales, performatividad y movimientos sociales en Chile 1985-1995"
Sociología,2014,UNIV.CATOLICA DE TEMUCO,La formación de los trabajadores sociales en Chile: un acercamiento interpretativo a la dimensión histórica-política de sus perspectivas teóricas
Sociología,2014,UNIV.DE LOS LAGOS,El campo político-discursivo chileno en un contexto de dislocación: continuidades y transformaciones (1997-2014)
Sociología,2014,UNIV.DE CHILE,"Moving towards adaptation to climate change: current practices developed in Chile, their usefulness, barriers to implementation, and opportunities for improvement"
Sociología,2014,PONT. UNIV. CATOLICA DE CHILE,¿Cómo comemos juntos?: un estudio descriptivo sobre las prácticas de comensalidad en adultos de la región metropolitana
Sociología,2014,PONT. UNIV. CATOLICA DE VALPARAISO,The relevance of crowd though in the chilean capital market
Sociología,2014,UNIV.DE CHILE,Operaciones de inclusión/ exclusión en sistemas territoriales complejos. Marcos e instrumentos para la observación socio- espacial
